{
  "schema_version": 1,
  "dataset_id": "cn-2025",
  "year": 2025,
  "source": {
    "publisher": "国务院办公厅",
    "title": "国务院办公厅关于2025年部分节假日安排的通知",
    "document_no": "国办发明电〔2024〕12号",
    "published_at": "2024-11-12",
    "url": "https://www.gov.cn/zhengce/zhengceku/202411/content_6986383.htm"
  },
  "holidays": [
    {"name": "元旦", "dates": ["2025-01-01"]},
    {"name": "春节", "dates": ["2025-01-28", "2025-01-29", "2025-01-30", "2025-01-31", "2025-02-01", "2025-02-02", "2025-02-03", "2025-02-04"]},
    {"name": "清明节", "dates": ["2025-04-04", "2025-04-05", "2025-04-06"]},
    {"name": "劳动节", "dates": ["2025-05-01", "2025-05-02", "2025-05-03", "2025-05-04", "2025-05-05"]},
    {"name": "端午节", "dates": ["2025-05-31", "2025-06-01", "2025-06-02"]},
    {"name": "国庆节、中秋节", "dates": ["2025-10-01", "2025-10-02", "2025-10-03", "2025-10-04", "2025-10-05", "2025-10-06", "2025-10-07", "2025-10-08"]}
  ],
  "holiday_dates": [
    "2025-01-01",
    "2025-01-28",
    "2025-01-29",
    "2025-01-30",
    "2025-01-31",
    "2025-02-01",
    "2025-02-02",
    "2025-02-03",
    "2025-02-04",
    "2025-04-04",
    "2025-04-05",
    "2025-04-06",
    "2025-05-01",
    "2025-05-02",
    "2025-05-03",
    "2025-05-04",
    "2025-05-05",
    "2025-05-31",
    "2025-06-01",
    "2025-06-02",
    "2025-10-01",
    "2025-10-02",
    "2025-10-03",
    "2025-10-04",
    "2025-10-05",
    "2025-10-06",
    "2025-10-07",
    "2025-10-08"
  ],
  "adjusted_workdays": ["2025-01-26", "2025-02-08", "2025-04-27", "2025-09-28", "2025-10-11"]
}
